{
  "agent": "critic-1",
  "value": "partly_specific",
  "evidence": [
    "Specific: the pick-up-day calendar marks library sessions as 'Open' (green dot on phones) and the basket offers named Wednesday/Saturday sessions with hours, which only make sense for a part-time volunteer desk (tool/default/1280-light, basket/default/1280-light).",
    "Specific: copy carries the product (deposit per tool, 'Available from Sat 10 Oct', 'Nothing is paid online', desk phone number in footer).",
    "Generic: the visual layer is a stock two-column card grid where every card has the same pale-green square with the same wrench glyph (find/default/1280-light); swapping the words would give any booking or catalogue app.",
    "Generic: the identity is the name 'Fernhill Tool Library' in bold body text with a small wrench icon; no typographic, colour or drawn device belongs to this library."
  ],
  "appeal": {
    "value": "plain",
    "unfinished": [
      "Placeholder image tiles on show: ten identical pale-green squares with the same wrench icon stand where tool photos or drawings would be (find/default all widths).",
      "Browser-default controls in the filter panel: native yyyy/mm/dd date input and a default select, misaligned with each other (find/filters-open/1280-light).",
      "No focal point on find, basket, confirm or done: each page is heading, paragraph, boxes; the done page has no confirmation moment beyond the H1 (done/default/1280-light).",
      "Footer band stops short above an empty grey band on short pages (basket/default/1280-light, done/default/1280-light).",
      "Phone tool titles truncated with ellipsis so both drills read 'Cordless drill 18 V, co...' (find/default/375-light).",
      "Calendar is a bare grid without a month name; sticky reserve bar and toast sit over it (tool/default/1280-light, tool/added/1280-dark).",
      "Basket session cards wrap into a ragged grid: one full-width card then five narrow ones at 1280, uneven heights at 768 (basket/default/1280-light, basket/errors/768-light)."
    ],
    "evidence": [
      "Clean, readable and consistent green-on-off-white with a working dark theme, but nothing on any screen is worth looking at for itself; it reads as a tidy default form set.",
      "First viewport of find at 1280: heading, intro paragraph, search bar, then a grid of identical icon tiles; after scroll, a heading-and-paragraph Opening times section.",
      "Execution slips (truncated titles, ragged session grid, default date input, overlapping sticky bar) make it look unfinished rather than deliberately quiet."
    ]
  },
  "written_at": "2026-10-09T22:50:00Z"
}
