{
  "agent": "critic-1",
  "value": "generic",
  "evidence": [
    "Swap (fail): put a seed library or a council equipment-hire desk into this frame and every identity-carrying element survives: system-like geometric sans in one voice, off-white grey-green ground, one dark-green accent on buttons, bordered white cards, a 16px line-art wrench beside the name. Only the copy (tool names, deposits, 'returned when it comes back clean and working', '14 Mill Lane') is bound to Fernhill.",
    "Category-guess (fail): predicted default for a community booking/library catalogue is a light ground, one 'trustworthy' green or blue accent, a search bar over a two-column card grid with thumbnails and availability pills, a month calendar for dates and radio cards for slots. find 1280-light matches every item; the predicted opposite (dark, hushed) is just the dark theme of the same frame.",
    "Similar-prompt (fail): a brief for a toy library or a community-garden equipment shed would land on the same choices: wrench/leaf icon + name, identical icon-placeholder thumbnails, green 'Available from' chips, calendar with 'Open' markers, check-and-confirm summary box. The overlap is near total.",
    "No signature: the closest candidate, the pick-up calendar marking 'Open' sessions (tool day-chosen 1280-light), is the category's standard availability calendar, and on the find page every card repeats the same wrench placeholder tile rather than the tool."
  ],
  "appeal": {
    "value": "plain",
    "unfinished": [
      "Placeholder boxes on show: every one of the ten tool cards on find carries the same pale-green square with the same wrench glyph instead of the tool (items-ladder-3m 1280-light, 375-light, 1440-dark).",
      "Identity is only the name in bold body text next to a small line icon; no mark, no product-world material anywhere (all routes, header).",
      "No focal point or anything to look at beyond text: basket, confirm and done are heading + bordered box + form/list on a flat grey-green ground.",
      "Empty band below the footer at 1280: basket, done (and confirm) end at ~700-900px and leave a flat grey strip under the footer (basket default 1280-light, done 1280-light).",
      "Bands that stop short: on done the 'What happens next' box stops at half width beside a full-width summary box; on basket one session card is full width while the other five sit in a cramped row of five (basket default 1280-light).",
      "Headings differ from body mainly in size and weight of the same sans; no typographic moment on any screen.",
      "At 375 the nav wraps into stacked two-line items ('Find a / tool', 'Basket / (1)', 'Opening / times') and the tool names are truncated to 'Cordless drill 18 V, co...' on both drill cards (items-ladder-3m 375-light, tool 375-dark).",
      "Fixed 'Reserve this tool' bar sits over the pick-up calendar, hiding rows and the chosen day (tool day-chosen 1280-light, tool default 375-dark)."
    ],
    "evidence": [
      "items-ladder-3m/default/1280-light: ten identical wrench placeholder tiles dominate the left of every card; the green chip is the only colour.",
      "basket default 1280-light and done 1280-light: short pages with an empty grey band under the footer; a half-width box beside full-width boxes.",
      "tool day-chosen 1280-light: sticky action bar overlaps calendar rows; the selected day (Mon 12) is under the bar.",
      "Calm green and clear copy are tidy and legible, so it is not unappealing; but nothing on any screen rewards a look, and it reads as a tidy default form."
    ]
  },
  "written_at": "2026-10-08T17:55:00Z"
}
