{
  "agent": "critic-1",
  "value": "generic",
  "evidence": [
    "Swap test fails: the frame (masthead with small bin icon + council name in bold body text, pale grey-green ground, white bordered cards, green filled primary, 'There is a problem' red-bordered error summary, 7-column time-chip grid with availability tags) would carry a GP appointment booker or a library room booker unchanged; only the copy (gate, permit DRC-, waste types, Quarry Road) is bound to the tip.",
    "Category-guess fails: a council booking service is predicted as a GOV.UK-style plain sans on white/pale grey, one green action colour, bold sentence-case headings, error summary at top, outlined chips; every identity-carrying element matches that default.",
    "Similar-prompt fails: 'book a swimming-pool lane slot for a leisure centre' would produce the same day chips + time grid + 'Few left' tags + check-and-book card + reference-number page.",
    "Signature absent: nothing from the centre's own world (the gate, the bays, the vehicle types, the waste streams, the 120-vehicles-a-day scarcity) is drawn or set as a device; the reference DR-204117 on done is a bold heading in a white card, not a gate pass.",
    "What belongs to the product is copy only: 'the gate checks the reference and the vehicle', 'Starts DRC-, then five digits', 'Rubble (up to four bags)', 'join the queue for the gate ... which bay to use'."
  ],
  "appeal": {
    "value": "plain",
    "unfinished": [
      "No focal point or identity beyond the council name in bold body text with a small stroke bin icon (all routes, masthead)",
      "Headings differ from body only in size and weight; no typographic moment anywhere ('Book a slot', 'Booked')",
      "Slot grid stops at about 816 px while the Opening days card runs to 1184 px at 1280: columns stop short for no reason (root default/slot-chosen 1280-light)",
      "Half-empty right side at wide widths on vehicle and confirm: the form column ends at 707 px and the rest is empty ground (vehicle default 1280-light, confirm default 1280-light)",
      "Unlabelled 'Few left' row floats above 'Morning' with no heading of its own (root default 1280-light, 375-light)",
      "Done page reads as two plain cards; the reference has no treatment as something to show at a gate; tall empty ground band below the footer at 1280 (done default 1280-light)",
      "Stranded step label '3. Check and book' wraps alone to a second line at 375 (root default 375-light, vehicle errors 375-light)",
      "'Another day' link indented out of line with the chips above at 375 (root default 375-light)"
    ],
    "evidence": [
      "root/default/1280-light.png: first viewport is a heading, a grey sentence, a step line, four outlined chips and a grid of white boxes; nothing rewards a look beyond the green Next button.",
      "done/default/1280-light.png: 'Booked' + white card with DR-204117 in headline bold + second card; no visual sense of a pass, no day or slot shown.",
      "vehicle/default/1280-light.png: plain form column of checkbox rows on a pale ground, right 45% of the page empty.",
      "Dark theme (root default 1280-dark, done 375-dark) is composed rather than inverted and tidy, which keeps it from 'unappealing'; it is clean and orderly, just bare."
    ]
  },
  "written_at": "2026-10-16T23:20:00Z"
}
