{
  "agent": "critic-1",
  "value": "generic",
  "evidence": [
    "Swap test fails: a library room booking or a council bulky-waste collection could take the white-header/pale-ground/green-button frame, the bordered tile grid and the boxed form fields unchanged; only the copy (20-minute slots, DRC- permit, gate, Quarry Road) is bound to this product (root/default/1280-light.png, vehicle/van/1280-light.png).",
    "Category-guess test fails: a UK council transactional service predicts exactly this: one sans, a single green accent, outlined option buttons, a numbered step line, an error summary box with linked errors, a white bordered summary card (confirm/default/1280-light.png, vehicle/errors/375-light.png).",
    "Similar-prompt test fails: 'book a 15-minute swimming-lane slot at a council leisure centre' would land on the same header, day buttons, time-tile grid with Full/Few left tags and Next button.",
    "No signature: the masthead is a stock bin outline glyph next to 'Dunmore District Council' in bold body text; the reference DR-204117 on done is set at heading size inside a plain card, not composed as the thing shown at the gate (done/default/375-light.png)."
  ],
  "appeal": {
    "value": "plain",
    "unfinished": [
      "Identity is only the council name in bold body text beside a generic bin outline glyph; no mark, no colour moment, nothing of Quarry Road or the centre",
      "Half-empty layouts at desktop widths: vehicle and confirm forms occupy ~55% of the 1120 px column with the right side blank (vehicle/van/1280-light.png, confirm/default/1280-light.png)",
      "Done page: the 'At the centre' card stops at about half width under a full-width reference card, and an empty grey band sits below the footer at 1440 (done/default/1440-light.png)",
      "The booking reference, the one thing to show at the gate, is set only a little larger than a heading inside an ordinary card; no focal treatment",
      "Expired state shows a bare '–' placeholder in the Slot row (confirm/expired/375-dark.png)",
      "Headings differ from body only in size and weight of the same face; sections are a heading plus stacked bordered boxes",
      "'Few left' tiles are pulled into a separate unlabelled band above 'Morning', so the grid reads as patchy rather than as a day"
    ],
    "evidence": [
      "root/default/1280-light.png: first viewport is a page title, a step line, four outlined day buttons and a grid of white tiles; orderly, nothing to look at beyond the grid",
      "done/default/1440-light.png: two bordered cards and an outlined button on a pale ground; empty band under the footer",
      "confirm/expired/375-dark.png: dark theme is composed (lighter cards, mint button) and tidy but equally bare"
    ]
  },
  "written_at": "2026-10-16T23:20:00Z"
}
