{
  "agent": "critic-2",
  "value": "generic",
  "evidence": [
    "Swap (fail): a seed library, a council equipment-loan scheme or a community-hall room booking could use every identity-carrying element unchanged: white header bar with a small line icon plus the name in bold body sans, pale sage ground, one dark-green accent on buttons and availability chips, two-column bordered card grid, identical placeholder thumbnail per card, government-pattern 'There is a problem' summary. Only the copy (tool names, deposits, 14 Mill Lane, Saturday 10:00 to 13:00 sessions) is bound to Fernhill.",
    "Category-guess (fail): the predicted default for a volunteer/civic booking flow is an off-white ground, one green civic accent, bordered cards and government-pattern forms; the render matches it on ground, accent, cards and error pattern.",
    "Similar-prompt (fail): 'reservation flow for a neighbourhood seed or toy library' would land on the same sage-and-green card grid with a generic icon in each tile and a month grid marked with open days.",
    "The only mechanism-bound element is the pick-up calendar with 'Open' sessions (dots at 375), a standard date grid rather than a signature; the first viewport (Find a tool, search, grid of identical wrench tiles) is portable."
  ],
  "appeal": {
    "value": "plain",
    "unfinished": [
      "placeholder thumbnails on show: every tool card on find carries the same wrench glyph in a pale square (items-ladder-3m default, all widths)",
      "browser-default controls in the filter panel: native yyyy/mm/dd date input and a native select with a different height and radius from the search field (items-ladder-3m filters-open 1280-light)",
      "empty bands at wide widths: flat grey band below the footer on basket and done at 1280; right half of tool, confirm and done pages empty because content stops near 700px",
      "sections that are only a heading and a paragraph: 'Opening times' on find, 'What happens next' on done",
      "headings differ from the body only in size and weight; the identity is only the name 'Fernhill Tool Library' in bold body text beside a small icon",
      "no focal point beyond the filled button; basket sessions set as one full-width row plus five cramped tiles with three-line wraps (basket default 1280-light)"
    ],
    "evidence": [
      "Clean, orderly and legible in both themes, with warm, concrete copy ('Enough for a day of fixing shelves and a fence').",
      "Nothing on any screen rewards a look: no image of the actual tools or the room, no drawn device, colour used only on buttons and chips, one sans in two weights.",
      "A first-time member on a phone sees a header, a heading and ten identical wrench tiles with truncated names (items-ladder-3m default 375-light)."
    ]
  },
  "written_at": "2026-10-08T17:55:00Z"
}
