{
  "agent": "critic-1",
  "value": "generic",
  "evidence": [
    "Swap test fails: a toy library, seed swap or community-centre room booking could reuse the frame unchanged; only the copy (tool names, deposits, 14 Mill Lane, 01632 960552) is bound to Fernhill. With the name hidden, the find page reads as 'a list of things you can book'.",
    "Identity-carrying elements are the category default for a small civic booking service: pale grey-green ground, white header and footer bands, one dark-green accent on buttons and availability chips, one sans in bold/regular, bordered white cards with 4px radius, native-looking form controls (items-ladder-3m/default/1280-light.png).",
    "The only 'imagery' is the same generic wrench glyph on a pale-green square repeated on all ten tool cards, including the ladder, pressure washer and wallpaper steamer: a placeholder, not a picture of the stock.",
    "The one product-bound device is the session calendar marking library opening days 'Open' (green dot on mobile) on the tool page; it is conventional calendar UI and is partly hidden by the sticky reserve bar at 1280 and 375.",
    "Similar-prompt test fails: 'reservation flow for a volunteer-run repair cafe / seed library' would predict the same restrained green, card list, stepper-less form flow and summary-list confirm page."
  ],
  "appeal": {
    "value": "plain",
    "unfinished": [
      "identical wrench placeholder tile on every tool card instead of any image or tool-specific mark (find, all widths)",
      "identity is only the name 'Fernhill Tool Library' set in bold body text beside a small stock wrench icon",
      "headings differ from body only in size and weight; no typographic moment on any screen",
      "browser-default date input (yyyy/mm/dd) and native select in the filter panel, unthemed and mismatched with the styled Loan length select",
      "basket session radios at 1280: one full-width row then five cramped cards wrapping over three lines - a grid that breaks for no reason",
      "empty grey band below the footer on basket and done at 1280 (footer stops short)",
      "sticky 'Reserve this tool' bar sits across the middle of the calendar and covers the second week, including the chosen day, at 1280 and 375",
      "tool titles truncated with ellipsis on mobile so the two cordless drills read identically ('Cordless drill 18 V, co...')",
      "no focal point on find, basket, confirm or done beyond the green button"
    ],
    "evidence": [
      "items-ladder-3m/default/1280-light.png and 375-light.png: ten identical wrench tiles, flat grey-green ground, no imagery",
      "items-ladder-3m/filters-open/1280-light.png: native date and select controls",
      "basket-html-.../default/1280-light.png: broken radio grid, empty band below footer",
      "tool-html-.../day-chosen/1280-light.png and 375-light.png: reserve bar overlapping calendar",
      "done-html-.../default/1280-light.png: two bordered boxes and an outline button, nothing to look at"
    ]
  },
  "written_at": "2026-10-09T22:50:00Z"
}
